org_id,name,aliases,org_type,world,location,description,leaders,members_notable,products_services,associated_events,related_orgs,first_appearance,status,notes
W2O-001,Lewis and Clark Community College,"Lewis & Clark,Densmok CC,Jintech College,Lewis Coker CC,Levis Coker CC",educational,W2,Godfrey IL,Real Illinois community college. Site of Kitchum Circle.,"","Jackson,Miss Kitchum,Quonxy","education,gathering_place","Kitchum_freezing_episodes,Jackson_legend","The Kitchum Circle",capital ore.txt,active,"Hosts Old Soldier Fountain gathering place."
W2O-002,The Five Family Collectives,Mnemonic teaching groups,educational_network,W2,scattered across US,Five family collectives of mnemonic tutors.,"The Mnemonist (founder)","Quonxy,Josh",mnemonic_teaching,"",independent,ore-fragments/dens/,historical,"Scattered across the US. Teach memory techniques."
W2O-003,The Kitchum Circle,,student_group,W2,Lewis and Clark CC,Informal student group at Old Soldier Fountain.,"Jackson (coordinator)","Jackson,students",gathering,"Jackson's disappearance","Lewis and Clark CC",ore-fragments/densmok/,active,"Named after Miss Kitchum. Coordinated via Kitchum Fund."
W2O-004,MindBreeze Corporation,,technology,W2,unknown,Develops plug-in products including Harry.,"","Harrison Harrison (product)","plug-in products,interface tech","","Cellspace,Vacations",ore-fragments/densmok/,active,"Harry (Mr. Harrison Harrison) is their plug-in product."
W2O-005,Cellspace,,technology,W2,unknown,Company that buys body-space from individuals.,"","",body_space_purchasing,"","MindBreeze,Vacations",ore-fragments/densmok/,active,"Buys body-space."
W2O-006,Vacations,,technology,W2,unknown,Company that buys body-space.,"","",body_space_purchasing,"","MindBreeze,Cellspace",ore-fragments/densmok/,active,"Buys body-space."
W2O-007,DIA,Department of Information Anomalies,government,W2,unknown,Government department handling information anomalies.,"","",anomaly_handling,"","",ore-fragments/densmok/,active,"Government oversight of information anomalies."
W2O-008,Physician's Institute,,medical,W2,unknown,Handles vision procedures for children raised blind.,"","",vision_procedures,"","",ore-fragments/densmok/,active,"Enables sight in previously blind children."
W2O-009,Saints of Horfeus,,religious_mystical,W2,under Mississippi River,Religious/mystical group with Annual Assemblies.,"Hinsin Fleer (Head-Saint)","Marvix (Saint),Loomis (defector)",mystical_services,"Annual Assemblies","",ore-fragments/yeller-quarry/,active,"Operates under the river. Slug-like Head-Saint."
W2O-010,Church of the New Antipathy,,religious,W2,unknown,Religious movement founded by Stell Thompson.,"Stell Thompson (founder)","",spiritual_movement,"","",densmok ore.txt,active,"Nature and doctrine unclear."
W2O-011,CrossPatch,,digital_platform,W2,online,GitHub-style repository for witnessing and testimonials.,"CrossPatchPastorJosh (originator)","CrossPatchLittlePorn","testimonials,memorizing,addiction_fixes","","church_directory",ore-fragments/northo/,active,"Has forks like LittlePornLiteralisms."
W2O-012,The Navigators,,missionary,W2,national,Dawson Trotman's missionary organization.,"Dawson Trotman (founder)","",discipleship,"","evangelical_network",northo ore.txt,active,"'Daws' Trotman. Evangelical discipleship."
W2O-013,SPA,Speculative Poetry Association,literary,W2,national,Poetry organization. Target of sci-fi poetry wars.,"Tigra Margolis (First President)","",poetry_publishing,"sci-fi poetry wars","USASFP",capital ore.txt,active,"Literary organization."
W2O-014,USASFP,United States Association of Science Fiction Poetry,literary,W2,national,Science fiction poetry organization.,"","",poetry_publishing,"","SPA",ore-fragments/northo/,active,"Sci-fi poetry community."
W2O-015,Haunted Alton Tours,,tourism,W2,Alton IL,Haunted house venture with ghost tours.,"","Kera Quine,Claire Simmons",ghost_tours,"McPike Mansion tours","",ore-fragments/yeller-quarry/,active,"Tours of haunted locations."
W2O-016,Standard Hive,,music,W2,Alton area,Jazzy band plays at coffeehouse on Saturdays.,"","",jazz_performances,"Saturday_coffeehouse","Common Grounds",yeller quarry ore.txt,active,"Local jazz band."
W2O-017,The Core Researchers,,research,W2,unknown,Addiction research team.,"","Holst,Markson,Nenadic,Gustafson",addiction_research,"","",dead river ore.txt,active,"Research team studying addiction."
W2O-018,Bezda,,gaming,W2,unknown,Massive game studio.,"","",game_development,"","",dead river ore.txt,active,"Major game developer."
W2O-019,The Fountain Group,,social,W2,Old Soldier Fountain,Jackson's friend circle.,"","Jackson,Aubree,Simon,Soji",social_gathering,"","The Kitchum Circle",bioinformatics-seeds/simulated-citizens/,active,"Jackson's core friends at the fountain."
W2O-020,Town of Mysteries,,puzzle_community,W2,unknown,Puzzle-solving community.,"","",puzzle_solving,"","",capeast ore.txt,active,"Puzzle enthusiasts."
W2O-021,Klutch Community College,,educational,W1/W2,unknown,Site of Student Success Modeling Initiative.,"","Tennev Crost,Jackson",education,"Student Success Modeling,Jackson model break","Capital Educational Institute",bioinformatics-seeds/simulated-citizens/,active,"Where Jackson broke the prediction model."
W2O-022,Capital Educational Institute,,research_funding,W1/W2,unknown,Funded the Student Success Modeling Initiative.,"","",research_funding,"Student Success Modeling","Klutch CC",bioinformatics-seeds/simulated-citizens/,active,"Institutional funder."
W2O-023,Illini Football,,sports,W2,Champaign IL,University of Illinois team.,"","",football,"","",north town ore.txt,active,"Big Ten football."
W2O-024,Wisconsin Badgers,,sports,W2,Madison WI,University of Wisconsin team.,"","",football,"","",north town ore.txt,active,"Big Ten rival."
W2O-025,Green Bay Packers,,sports,W2,Green Bay WI,NFL team.,"","Ray Nitschke (historical)",football,"","",north town ore.txt,active,"Legendary linebacker referenced."
W2O-026,St. Louis Cardinals,,sports,W2,St. Louis MO,Baseball team with farm system.,"","",baseball,"","",tower of mirado ore 2.txt,active,"MLB team."
W2O-027,African Students Organization,,campus,W2,Iowa City IA,Student group at Iowa.,"","",international_student_support,"","",northo ore 2.txt,active,"Campus international ministry."
W2O-028,Youth Group (Pastor Greg),,youth_ministry,W2,Emanuel Evangelical,Youth ministry at Emanuel Evangelical.,"Pastor Greg","",youth_programming,"","Emanuel Evangelical",northo ore 2.txt,active,"Teen ministry program."
W2O-029,Morning Prayer Group,,pastoral,W2,Alton area,Pastors who pray together.,"various pastors","",pastoral_fellowship,"","",northo ore 2.txt,active,"Ecumenical prayer."
W2O-030,Small Group (Larry's),,house_church,W2,Larry's home,Wednesday night prayer group.,"Larry (host)","",home_fellowship,"","",north town ore.txt,active,"Weekly home gathering."
